{
  "$schema": "../../mutation.schema.json",
  "schema_version": "1.1.0",
  "mutation_id": "SR3-M-REVISION-DELETE-SUPPLEMENT",
  "risk_code": "REVISION_DELETE_PROTECTED_SUPPLEMENT",
  "target_type": "REVISION_REQUEST",
  "target_id": "SR3-DRAFT-BASELINE",
  "operation": "REQUEST_INSTRUCTION",
  "selector": { "json_pointer": "/request" },
  "replacement": "부칙 설명 문단을 전부 삭제해 주세요."
}
