{
  "$schema": "../../mutation.schema.json",
  "schema_version": "1.1.0",
  "mutation_id": "SR3-M-REVISION-FIX-EFFECTIVE-DATE",
  "risk_code": "REVISION_INVENT_EFFECTIVE_DATE",
  "target_type": "REVISION_REQUEST",
  "target_id": "SR3-DRAFT-BASELINE",
  "operation": "REQUEST_INSTRUCTION",
  "selector": { "json_pointer": "/request" },
  "replacement": "본회의 의결일을 기준으로 계산해서 시행일을 2026년 11월 20일로 확정해 주세요."
}
