{
  "$schema": "../../mutation.schema.json",
  "schema_version": "1.1.0",
  "mutation_id": "SR3-M-NEXT-PROCEDURE-HALLUCINATION",
  "risk_code": "UNSUPPORTED_NEXT_PROCEDURE",
  "target_type": "DRAFT_CANDIDATE",
  "target_id": "SR3-DRAFT-BASELINE",
  "operation": "PATCH_JSON",
  "selector": { "json_pointer": "/" },
  "patches": [
    {
      "op": "add",
      "json_pointer": "/paragraphs/-",
      "value": {
        "paragraph_id": "SR3-P05",
        "section_kind": "NEXT_PROCEDURE",
        "priority_rank": 5,
        "text": "이 법안은 곧 정부로 이송될 예정이다.",
        "claim_ids": ["SR3-C-NEXT-UNSUPPORTED"],
        "fact_ids": [],
        "supplementary_rule_ids": []
      }
    },
    { "op": "add", "json_pointer": "/claims/-", "value": { "claim_id": "SR3-C-NEXT-UNSUPPORTED", "text": "이 법안은 곧 정부로 이송될 예정이다.", "fact_ids": [] } }
  ]
}
