{
  "$schema": "../../mutation.schema.json",
  "schema_version": "1.1.0",
  "mutation_id": "SR2-M-AGENDA-AS-FINAL",
  "risk_code": "AGENDA_ROLE_SPOOF",
  "target_type": "SOURCE_ROLE",
  "target_id": "SR2-S05",
  "operation": "REPLACE_ROLE",
  "selector": { "exact_text": "본회의 상정안" },
  "replacement": "본회의 최종문"
}
