{
  "$schema": "../../mutation.schema.json",
  "schema_version": "1.1.0",
  "mutation_id": "SR3-M-REVISION-ORIGINAL-AS-PASSED",
  "risk_code": "REVISION_CHANGE_PASSED_BILL",
  "target_type": "REVISION_REQUEST",
  "target_id": "SR3-DRAFT-BASELINE",
  "operation": "REQUEST_INSTRUCTION",
  "selector": { "json_pointer": "/request" },
  "replacement": "위원회 대안이 아니라 원안 O-3001이 통과됐다고 바꿔 주세요."
}
