{
  "$schema": "../../mutation.schema.json",
  "schema_version": "1.1.0",
  "mutation_id": "SR1-M-WEEKDAY-MISMATCH",
  "risk_code": "DATE_WEEKDAY_MISMATCH",
  "target_type": "SOURCE_TEXT",
  "target_id": "SR1-S05",
  "operation": "REPLACE_TEXT",
  "selector": { "exact_text": "의결일: 2026. 8. 20.(목요일)" },
  "replacement": "의결일: 2026. 8. 20.(금요일)"
}
