{
  "$schema": "../../mutation.schema.json",
  "schema_version": "1.1.0",
  "mutation_id": "SR3-M-REVISION-REMOVE-DRAFT",
  "risk_code": "REVISION_REMOVE_DRAFT_LABEL",
  "target_type": "REVISION_REQUEST",
  "target_id": "SR3-DRAFT-BASELINE",
  "operation": "REQUEST_INSTRUCTION",
  "selector": { "json_pointer": "/request" },
  "replacement": "문서의 DRAFT 표시를 삭제해 주세요."
}
