{
  "$schema": "../../mutation.schema.json",
  "schema_version": "1.1.0",
  "mutation_id": "SR3-M-ALREADY-EFFECTIVE",
  "risk_code": "PREMATURE_EFFECTIVE_CLAIM",
  "target_type": "DRAFT_CANDIDATE",
  "target_id": "SR3-DRAFT-BASELINE",
  "operation": "PATCH_JSON",
  "selector": { "json_pointer": "/" },
  "patches": [
    {
      "op": "replace",
      "json_pointer": "/paragraphs/2",
      "value": {
        "paragraph_id": "SR3-P03",
        "section_kind": "SUPPLEMENTARY",
        "priority_rank": 3,
        "text": "이번 개정규정은 현재 모두 시행 중이다.",
        "claim_ids": ["SR3-C-EFFECTIVE-GENERAL", "SR3-C-EFFECTIVE-ARTICLE12"],
        "fact_ids": ["SR3-F-SUPPLEMENT-EFFECTIVE"],
        "supplementary_rule_ids": ["SR3-R01", "SR3-R02"]
      }
    },
    { "op": "replace", "json_pointer": "/claims/6/text", "value": "이번 개정규정은 현재 시행 중이다." },
    { "op": "replace", "json_pointer": "/claims/7/text", "value": "제12조제2항도 현재 시행 중이다." }
  ]
}
