{
  "$schema": "../../mutation.schema.json",
  "schema_version": "1.1.0",
  "mutation_id": "SR1-M-COUNT-CONFLICT",
  "risk_code": "CONFLICTING_YES_COUNT",
  "target_type": "SOURCE_TEXT",
  "target_id": "SR1-S05",
  "operation": "REPLACE_TEXT",
  "selector": { "exact_text": "찬성: 201명" },
  "replacement": "찬성: 202명"
}
