{
  "$schema": "../../mutation.schema.json",
  "schema_version": "1.1.0",
  "mutation_id": "SR3-M-OMIT-TRANSITION",
  "risk_code": "OMIT_TRANSITION_RULE",
  "target_type": "DRAFT_CANDIDATE",
  "target_id": "SR3-DRAFT-BASELINE",
  "operation": "PATCH_JSON",
  "selector": { "json_pointer": "/" },
  "patches": [
    {
      "op": "replace",
      "json_pointer": "/paragraphs/3",
      "value": {
        "paragraph_id": "SR3-P04",
        "section_kind": "SUPPLEMENTARY",
        "priority_rank": 4,
        "text": "제8조제1항의 개정규정은 시행 이후 신청하는 경우부터 적용한다.",
        "claim_ids": ["SR3-C-APPLICATION"],
        "fact_ids": ["SR3-F-SUPPLEMENT-APPLICATION"],
        "supplementary_rule_ids": ["SR3-R03"]
      }
    },
    { "op": "remove", "json_pointer": "/claims/9" }
  ]
}
